hebrew,english
"לא נעלם ממנו כי סרבנות מצפון - בעיקר סרבנות מצפון )טרם פורסם(. סלקטיבית - הופכת בשנים האחרונות לתופעה שכיחה משהיתה בעבר,",It has not disappeared from it because conscious refusal – mostly unpublished conscious refusal – has become a common phenomenon in the past few years.
"ואולם מבחינה סטטיסטית מדובר, בשלב זה, במקרים ספורים בלבד אשר לנשים, נתקלנו עד כה במקרה אחד יחיד ומיוחד - עניינה של .העותרת שלישית, ובכך עיקר: לא נשתכנעתי כי קיומו של דיון נוסף - .11 .12","But statistically it is, at this point, only a few cases that for women, we have encountered so far in one unique and special case - the issue of the third headline, and thus the most important: we will not be convinced that the existence of another discussion -.11.12"
". טעםואפילו תשוּנֶה ההלכה שנפסקה - יהיה בו כדי לסייע לעותרת הדבר: גם אם נחלוק על מסקנת בית-המשפט כי המושג ""טעמים לחוק שירות ביטחון מצמצם עצמו לטעמי 39שבמצפון"" בהוראת סעיף מצפון שמקורם בדת, במסורת ובהווי משפחתי או עדתי - אודה כי","The taste and even the change of the move that has been stopped - will be in it to help address the matter: even if we share the court's conclusion that the concept of ""smack of the law of security service is reduced to my taste 39 in conscience"" in the provision of a section of conscience that is derived from religion, tradition and family or testimony - I will admit that"
"מסקנה זו קשתה עלי - קרוב מאוד להניח כי הבחנות שנעשו לעניינו של לחוק - בין ""מצפון כולל"" לבין ""מצפון סלקטיבי"" - יוחלו וייושמו36 סעיף . אכן, אף בית-המשפט בענייננו סבר כי ""עניינו 39אף על הוראת סעיף [ 39]","This conclusion made me - very close to supposing that the differences made in the matter of law - between ""including conscience"" and ""selective conscience"" - will be applied and implemented."
"'המונעים)ג( לחוק המדבר בטעמי מצפון 39בבירור גם מלשונו של סעיף , בהבדלככלל הווי אומר – משירות בטחון ', אותה מלשרת בשירות בטחון ,13משירות בטחון המותנה בתנאים כאלה ואחרים"" )שם, פיסקה ההדגשה במקור - מ' ח'(. בעניין זה הלך בית המשפט בדרכה של","In the words of the Holy Prophet (peace and blessings of Allah be upon him), the Holy Prophet (peace and blessings of Allah be upon him), the Holy Prophet (peace and blessings of Allah be upon him), the Holy Prophet (peace and blessings of Allah be upon him), the Holy Prophet (peace and blessings of Allah be upon him), the Holy Prophet (peace and blessings of Allah be upon him), the Holy Prophet (peace and blessings of Allah be upon him), the Holy Prophet (peace and blessings of Allah be upon him) and the Holy Prophet (peace and blessings of Allah be upon him)."
"נ'הורוביץ 269/51 )השוו: בג""צ 39הפסוקה בעניינו של סעיף ההלכה ( ובדרך הסלולה שכבש בית-משפט זה 1656, פ""ד ה אלוף מזא""ה ו-36בסוגיית הסירוב. מודע אני כמובן להבדלים שבין הוראות הסעיפים שלחוק, אלא שלא מצאתי כי במהותם של דברים קיים הבדל ביניהם39",In the words of the Holy Prophet (peace be upon him) and the Holy Prophet (peace be upon him) in the words of the Holy Prophet (peace be upon him) in the words of the Holy Prophet (peace be upon him) in the words of the Holy Prophet (peace be upon him).
"לענייננו הנה-כי-כן, אפילו תתקבל העתירה לדיון נוסף ותשונֶה .12 .13 ההלכה שנפסקה, קרוב להניח כי הלכה חדשה שתיפסק תחיל על עניינן , אותם מבחנים שנקבעו לעניינם של 39של נשים בהקשרו של סעיף","In this case, even the request for a further discussion will be accepted.12.13 The move that has been stopped, is almost supposed to be a new move that will be stopped first on their affairs, the same tests that have been established for the affairs of 39 of the women in connection with Article 13"
"39 שלחוק. כך ייקבע כי הוראת סעיף 36גברים בהקשרו של סעיף - שלחוק לא תזכה בפטור משירות ביטחון ""סרבניות סלקטיביות"" דוגמת העותרת - המסרבות לשרת שירות ביטחון מטעמים אידיאולוגיים ומדיניים. ההכרעה בדיון הנוסף יכול אפוא שלא תהא לה השפעה","39 of the law. thus shall be stipulated that the provisions of article 36 men in connection with the article - that the law won't get exempt from the security service ""selective rebels"" such as the title - refusing to serve the security service for ideological and political reasons."
"ממשית על העותרת, ובפועל אפשר שלא תהא לה כל תוצאות בעולם סרבניות אידיאולוגיות מלאות תזכינה ממילא לפטור, בין המעשה; , ואילו39 בין מכוחה של הוראת סעיף 36מכוחה של הוראת סעיף ""סרבניות סלקטיביות"" לא תזכינה לפטור, לא מכוחה של הוראת סעיף","In fact on the title, and in practice it is possible that it will not have any results in the world of the complete ideological rebellion that will at all be exempt, between the fact; while 39 between the power of the provision of article 36The power of the provision of article ""selective rebellion"" will not be exempt, not from the power of the provision of article."
"ידענו, אין זה . במקרים מעין-אלה, 39 ולא מכוחה של הוראת סעיף 36 מדינת 2353/03. ראו והשוו: דנ""פ ראוי להורות על קיומו של דיון נוסף , פ""ד יבאניות מיכל ומשא נ' שר האוצר 3/58 )לא פורסם(; ד""נאסלאן נ' ישראל","We know, it is not. in such cases, 39 and not from the power of the provisions of Article 36 of the State 2353/03. see and compare: DNA is worthy of ordering the existence of a further discussion, F.D. Yabaani container and S.N. Minister of Finance 3/58 )not published(; D.N. N. Israel"
"808/95; דנג""ץ794 ,789, פ""ד יבווליס ואח' נ' ריבלין ואח' 8/58; ד""נ1849 ; דנ""א841-840 ,837 (1 פ""ד מט היועץ המשפטי לממשלה, נ' אמיתי וכו' )לא פורסם((. אוסיף ואדגיש: איילון חברה לביטוח נ' ציון חיימס 3444/97","808/95; DGZ794,789, P.D. Yebvalis and Ah. N. Rivlin and Ah. 8/58; D.N.1849; D.A.841-840,837 (1 P.D.M. Legal Adviser to the Government, N. Real, etc.)Not Published(."
"אינני קובע במפורש כי זו אמנם תהא תוצאת פסק הדין בדיון הנוסף ואולם עוסקים אנו בסיכויים ובסבירויות, ואלה מכריעים את הכף לחובת והעותרת. למותר לומר כי אינני דן בשאלה מה ייעשה בעותרת, ואם נכון .13","I do not clearly say that this will be the result of the judgment in the further discussion but we deal with the possibilities and probability, and these determine the cover of the obligation and the title."
"לשפוט אותה ולשולחה לכלא. שאלה זו לא הועמדה להכרעתי וממילא לא אכריע בה. אעיר עם זאת, כי לא נוכל להתעלם מן העובדה שבנושא זה של גיוס לצבא נקבעו בחוק הסדרים מיוחדים לנשים, בשונה מן ההסדר החל על גברים.","This question has not been submitted to my judgment and I will never decide on it. However, I will not be able to ignore the fact that in this subject of recruitment to the army specified in the law special arrangements for women, unlike the arrangement applied to men."
"העתירה נדחית. ממילא נדחית גם בקשתה של האגודה לזכויות .14 האזרח בישראל להצטרף לעתירה כ""ידיד בית המשפט"". נ(.7.11.04היום, כ""ג בחשוון תשס""ה ש ו פ ט","The claim is rejected. however, the request of the Association for the Rights of the Citizen of Israel to join the claim as a ""Friend of the Court"" is also rejected."
